annex_arizona_title;Annex Arizona;;;;
annex_arizona_desc;Arizona has long orbited our influence. Now we are finally in a position to fully integrate the Arizonans.;;;;
californian_legacy_title;Reclaim the Legacy of California;;;;
californian_legacy_desc;We are now in a position to attempt to reclaim the legacy of California, becoming a strong power in our own right, independent of foriegn influence.;;;;
cascadian_ambition_title;Claim Cascadia;;;;
cascadian_ambition_desc;The Cascadians and Alaskans are not too different to our own people. We should unite.;;;;